date_added;id;name;brand;owner;condition;condition_desctription;retail_price;tc_price;sold
;outfit.00731d8db5504c64af534f9f43a7f061;L Heaston Skirt Hushed Violet;Samsøe Samsøe;FJONG;5 - Damaged;Flekker som ikke går bort. ;800;50.0;True
2022-06-10;outfit.00fa8d1fd5804fe78ac284c2e0c28b4e;L Navy Buffalo Skirt;Holzweiler;FJONG;5 - Damaged;Small black dots on shoulders and back (see image);4700;1175.0;False
2023-10-31;outfit.0106cbd7e23f41da92e3081146b4ad03;Juliette Skirt Red Line;Samsøe & Samsøe;FJONG;5 - Damaged;Store flekker i front;2900;580.0;False
2022-08-18;outfit.0113e4422a3f408f8fc9a94d2861474f;Sand Poddle99 Blazer;Holzweiler;Holzweiler;5 - Damaged;Lite Hull både foran og bak. Kan sys? eventuelt patche;2400;300.0;False
2023-01-10;outfit.0118b605888840348f80965c2d8865cf;XS Wabi Embroidered Bright White Shirt;FWSS;FWSS;5 - Damaged;;;;False
;outfit.0135e308c548441da2f132684fda6ec0;S1 Pleated Arm Top Aspen Gold;MAUD;Høyer;1 - As new;tror det bare er fordi den er en singlet;500;250.0;False
2023-05-15;outfit.01738c87529546bfb8c032dc16027359;S Shoulder Embellished Tunic;SoyaAulait;Soyaaulait;5 - Damaged;;1700;340.0;False
2023-01-10;outfit.02007510be7b409890e2b0662fcd198a;The Wrap Dress, Black;AWAN;AWAN;4 - Minor defects;flekker som ikke går bort;10500;3150.0;False
2023-05-15;outfit.023f07d439ba4be7895260a95cde5ad4;S White Ribbed Sweater;Urban Pioneers;Urban Pioneers;5 - Damaged;;1800;310.0;True
;outfit.028f434e3010464ebe6faba11f8218f9;L Cocos Seaweed Skirt;Samsøe Samsøe;FJONG;5 - Damaged;;2000;349.0;False
;outfit.02b7dbe5f5f94207ba29423997168b74;M Sanne Misty Lilac Dress;FWSS;FJONG;4 - Minor defects;;7000;1400.0;False
2023-09-15;outfit.02cbb0ff0c1348ce9fb9906805fb9049;Miranda Green Dress;MØRCK;Marianne Mørck;1 - As new;;;900.0;False
2023-12-12;outfit.02de6177cfea418b8530f218f554f369;XS Delicate Semi Couture Bell Sleeve Powder Dress;byTiMo;FJONG;5 - Damaged;;2500;500.0;False
;outfit.02fbd003b37e4bcd9ea5fd8e933ec1f8;L1 Cameron Creme Blouse;Ganni;Høyer;5 - Damaged;;1900;299.0;True
2024-01-25;outfit.03f79bfddf674c2086334e6d526df62a;Rotie Pants Silver;ROTATE Birger Christensen;DSN;5 - Damaged;;1900;380.0;False
;outfit.043a430a63b34151a6489d2863ea11aa;L Sealiner Nappa Tapenade;FWSS;FJONG;5 - Damaged;;2800;849.0;True
;outfit.0451efb5440649ff929b90ee8fca539a;L Draped Back Slip Top;Theory;Høyer;5 - Damaged;;1900;380.0;True
2023-10-31;outfit.04845476e9cc411e808824b0b4b17886;Orange Lace Shirt;Baum und Pferdgarten;FJONG;5 - Damaged;;2000;400.0;True
2023-10-31;outfit.04bc4b5d40ed441b9fe2cfa36b8fa482;Cybill Dusty Blue;Samsøe & Samsøe;FJONG;5 - Damaged;;2700;200.0;False
2023-09-19;outfit.058e893415824af6b64749cfc051e74d;Faye Shoulder Dress Blue;MagMaLou;MagMaLou;5 - Damaged;;1700;200.0;True
2023-05-15;outfit.05b80f189d6b4c379b1a751729525775;M Ecru Lenient Jumpsuit;Holzweiler;Holzweiler;5 - Damaged;;2900;900.0;True
2023-05-15;outfit.05bb402339704878860af46b292b6c19;M Mint Renè Gown;SOYAAULAIT;Soyaaulait;5 - Damaged;;1500;300.0;False
2024-01-25;outfit.05fc2f3b08cd4ee2847bfe576fd9e02f;Voile Grandfather Shirt;Forte Forte;Den Dama;5 - Damaged;;4200;1500.0;True
2023-01-10;outfit.0642897bbe9e4a7b918050887c846760;Black Gallè Maxi Dress;Soyaaulait;Soyaaulait;5 - Damaged;Krympet;2800;400.0;True
2023-09-19;outfit.064d46ea3457402a9085a81d53f419f0;Grey Marte Rococo Jacket;SOYAAULAIT;Soyaaulait;5 - Damaged;;4000;800.0;False
2023-05-15;outfit.06cf56f105d344b192e1c6eb0e5cf9a3;XXL Ecru Lenient Jumpsuit;Holzweiler;Holzweiler;5 - Damaged;;3600;720.0;False
2023-06-15;outfit.06d28078470e43cdbd25106ee1beb3d1;S Stone Shirt;Maja Stabel;Maja Stabel;5 - Damaged;;2000;150.0;True
2022-06-10;outfit.06d28078470e43cdbd25106ee1beb3d1;S Stone Shirt;Maja Stabel;Maja Stabel;3 - Good condition;to små flekker på venstre side av skjørtet front;1200;360.0;False
;outfit.07602873909f41b6a572fb50dc042dbd;S Gala Olive Pants;Hofmann Copenhagen;FJONG;5 - Damaged;;3800;;False
2023-05-15;outfit.076a212331ff4be58cba85c76b2af7c2;L Navy Pinstriped Knee Length Skirt;C.L.E.A.N. by Christina Ledang;C.L.E.A.N. by Christina Ledang;5 - Damaged;;2200;440.0;True
2023-09-19;outfit.076fec1447b74630b56bda6173fabe36;Bianca Lace Jumpsuit;MagMaLou;MagMaLou;5 - Damaged;;1300;260.0;True
;outfit.07b324742c994278b781ffb86845e72a;XS Carlico Trousers;Second Female;Villoid;5 - Damaged;;2500;;False
2023-09-15;outfit.080348a4366a445cb91d8ee59e9594de;Blue Fog Love Dress;Maud;Villoid;5 - Damaged;;1500;300.0;True
2023-12-12;outfit.08166c3fafc744f494e20c58ab36366d;M Your Woman Jet Stream White;FWSS;FWSS;5 - Damaged;;;;False
2024-01-25;outfit.086c3881445747d98bce36eb00f79a50;Floral Ring My Bell Top;Høst & Vår;Høst & Vår;5 - Damaged;;1500;;False
2022-09-15;outfit.08df6fb664e24da7b0ce3b7153a1cfc1;XS Bright White Gunhild Shirt;FWSS;Villoid;5 - Damaged;;1000;200.0;False
2023-12-12;outfit.08e4ee837bf542279687d7e91f98329f;M Kevin Pants;Designers Remix;Høyer;5 - Damaged;;3900;780.0;False
2023-05-15;outfit.091fce5fb26e4a22ba2e11d67dcb1357;XS Ceiling Block Print Aria Dress;Holzweiler;Holzweiler;5 - Damaged;;3900;780.0;False
;outfit.095d47a3b838445788dc913bf53b0c2b;XL Dusk Blue Jeans Jacket;Creative Collective;Villoid;5 - Damaged;;5400;1080.0;False
;outfit.095de7562bbf447f8dc83ec1a0e8edb4;M Bodil Red Roses Dress;FWSS;FJONG;5 - Damaged;;4000;800.0;False
2023-09-19;outfit.09a274c103524f30bd8e3fcc3cbab7c1;Chiara Seafoam Midi Dress;Faithfull The Brand;FJONG;5 - Damaged;;4500;900.0;False
2023-05-15;outfit.09e10a444340406da8d16883ca9ddd5a;XL Navy Knitted Vest Dress;C.L.E.A.N. by Christina Ledang;C.L.E.A.N. by Christina Ledang;5 - Damaged;;4500;900.0;False
2023-01-10;outfit.09f0b5ce052e4048ab142656ea9e82b2;1 Dante Dress Off White;IBEN;IBEN (Storheil Agency);5 - Damaged;;2200;440.0;False
2023-09-15;outfit.0aba6a0181244b909052de563879ca08;Signy Striped Shorts;FWSS;FWSS;5 - Damaged;;3400;680.0;False
2024-01-25;outfit.0abe40e33d26443f9edd93d78d4cb20e;S3 Cameron Dotted Blouse;Ganni;Høyer;5 - Damaged;;2600;520.0;False
2023-09-15;outfit.0ac56d1cc0a643c48ce188e68f8a6fee;Løvmeis Oversized Tee;ILAG;Qomo;5 - Damaged;;2900;580.0;False
2023-06-15;outfit.0b544c65a87645459ce9844f749e178f;M Satin Wrap Drawing Dress;byTiMo;FJONG;5 - Damaged;;1800;360.0;False
2023-09-19;outfit.0b5d348bcc9149d3b5b9b297bf008eda;Ceiling Block Print Aria Dress;Holzweiler;HOLZWEILER;5 - Damaged;;3500;700.0;False
2023-05-15;outfit.0b79d901b7984880a14b1056d6c8f7dc;S Green Voss Skirt;Holzweiler;Holzweiler;5 - Damaged;;3500;700.0;False
2023-09-19;outfit.0b7f8987b0b44a208cfe7f2ce5b35691;Faye Shoulder Dress Blue;MagMaLou;MagMaLou;5 - Damaged;;2300;460.0;False
2023-09-19;outfit.0b851632b47f44c2bb4e438c691d3f6d;Drew Dress;MagMaLou;MagMaLou;5 - Damaged;;3000;600.0;False
;outfit.0be9f27abad946bb85bf726761aa1042;L Kevin Skirt;Designers Remix;Høyer;5 - Damaged;;2400;480.0;False
;outfit.0c20133857c441f59e528b29387fed2b;Ella&Il;Hofmann Copenhagen;FJONG;5 - Damaged;;900;180.0;False
;outfit.0cac6908c7c84c2ab497ead9592357b9;XS 1 Cameron Dotted Blouse;Ganni;Høyer;5 - Damaged;;2000;400.0;False
;outfit.0d1682558d8e43fa830ad2846c3e9f46;XS Golden Glow Bianca Shirt;Second Female;Villoid;5 - Damaged;;1000;200.0;False
2023-01-10;outfit.0d500dc7edb74304b062649cbd3ce268;L Beige Mae Jumpsuit;Urban Pioneers;Urban Pioneers;5 - Damaged;;2900;580.0;False
2022-11-23;outfit.0d500dc7edb74304b062649cbd3ce268;S Pink Straight Trousers;Theory;HØYER;5 - Damaged;;1500;300.0;False
2023-05-15;outfit.0d9f8d1b979b440c95059e5072bbbe16;XS Lense Shorts;Holzweiler;Holzweiler;3 - Good condition;"synlig slitt på høyre side foran. Litt nuppete og ""tynt""";2400;600.0;True
2023-10-31;outfit.0dcd9f8fa95a4d81a7bb43df05668e4d;Lace Burgundy Tunic;Gucci;Gunhild Stordalen;5 - Damaged;;1400;280.0;False
2023-05-15;outfit.0de0bdfd2b7446978b4acf5a593630ed;XS BROQUÉ Classic Army Crewneck;Cardsome;Cardsome;5 - Damaged;;1100;220.0;False
2023-09-15;outfit.0de869d31f424399b9c82775db98449d;Courtney Slip Under Dress;Riccovero;FJONG;5 - Damaged;;1100;220.0;False
2023-09-15;outfit.0e083ac25d7e42db96299b2528122198;Aqua Tristein Dress;ILAG;ILAG;5 - Damaged;;900;180.0;False
2023-12-12;outfit.0e3d1cd3cac34dc7bcacd5a9faa3a6be;XS Tearz Vanilla Ice White Shirt;FWSS;FWSS;5 - Damaged;;1000;200.0;False
2023-09-15;outfit.0e83d5951196473d9a5492ced2f485f5;Alice Paisley Dress Hydra Blue;Rodebjer;Rodebjer;4 - Minor defects;;2500;500.0;False
2023-05-15;outfit.0e8c1bed7cca467bbc7ddccdabfbe289;XS Dark Grey Mikine Skirt;Holzweiler;Holzweiler;4 - Minor defects;flekk på høyre arm, på underarmen;2500;600.0;False
2023-09-19;outfit.0e92130f6b144c8db776928ba4f0e01c;Faye Shoulder Dress Black;MagMaLou;MagMaLou;5 - Damaged;;900;180.0;False
2023-01-10;outfit.0ea83cb5b5ec47cf9644bc15f365caa4;1 Cameron Skirt;Ganni;Høyer;4 - Minor defects;Unremovable stains;1900;599.0;False
2023-01-10;outfit.0ec5b76f554546269b80b4688c32691c;Oda Denim Blouse;Urban Pioneers;Urban Pioneers;5 - Damaged;;2000;400.0;False
;outfit.0efb674998e64290b542673894e4bffe;XS Gloriosah Cream Blouse;By Malene Birger;Høyer;3 - Good condition;;2500;849.0;False
2024-01-25;outfit.0eaa358af14e469894062591bd42f38b;M1 Flashback Roulette Top;Ghospell;For Ynde;2 - Very good condition;;2100;600.0;False
2023-01-12;outfit.0f503415f7764ce49e9acd3de347cdaf;M Summer Crochet Dress White;Pia Tjelta byTiMo;FJONG;5 - Damaged;;1300;260.0;False
2023-09-19;outfit.0fa577c0f2a5456d9312b3507b4303c6;Faye Shoulder Dress Blue;MagMaLou;MagMaLou;5 - Damaged;;1300;260.0;False
2024-01-25;outfit.100400d50acc42a4be7fe2f8e438f861;Bobbie Top;Diane von Furstenberg;FJONG;5 - Damaged;;900;180.0;False
2023-12-12;outfit.1009bfebb9ed4c86aeb46dd5584dd419;Chantal Blouse;Six Ámes;Ann-Kristin Asmus-Thorvaldsen;5 - Damaged;;1300;260.0;False
2023-09-19;outfit.100cfc2babe742dd92867d69ddf0936e;Faye Shoulder Dress Blue;MagMaLou;MagMaLou;5 - Damaged;;1300;260.0;False
2022-09-22;outfit.1054e796a700461b91317a8c7e8197bd;S Sage Wrap Skirt;Yaya;For Ynde;4 - Minor defects;;8500;1700.0;False
;outfit.111c30e5fc104510b31cdd5e6cc676c8;M Stranda Skirt Yellow Stripe;Holzweiler;FJONG;3 - Good condition;;1400;280.0;False
;outfit.111aa3d2b67a4bfd8be45b0039bb5ed1;M Oda Jeans;Holzweiler;Holzweiler;5 - Damaged;Flekker bak på nakken. Synlig;2900;400.0;False
2023-10-31;outfit.114e772d2238442c909f9804c6d1c477;Misty Green Agave Dress;By Malene Birger;FJONG;4 - Minor defects;unremovable stains;3500;949.0;False
2023-06-15;outfit.117f18d4394a4b3fbbb4eb53aa38b25b;M Black Mika Hood;ella&il;Villoid;4 - Minor defects;reparerte hull nederst på benet. ;1800;450.0;True
;outfit.1181979d8cc24555b4bf0c91c7b70a2a;M Avalon Dress;Baum und Pferdgarten;Høyer;3 - Good condition;Wear and tear;3900;1299.0;False
2022-06-10;outfit.118f15046d0b45d48929bb91df474761;L Ellixa Night Blue Dress;By Malene Birger;FJONG;3 - Good condition;;2300;550.0;False
2023-09-15;outfit.1198ce35faff4d8b877faba218a75680;Blossom Embroidery Embellished Tunic;SoyaAulait;Soyaaulait;3 - Good condition;;2000;500.0;False
2023-05-15;outfit.1198ce35faff4d8b877faba218a75680;Blossom Embroidery Embellished Tunic;SoyaAulait;Soyaaulait;3 - Good condition;;2300;600.0;False
2024-01-25;outfit.12777bb9bd1e40eea12a257de5d9d32d;Wilma Blouse;Britt Sisseck;Høyer;5 - Damaged;Utvaskset, strykemerke med hull høyre side nederst.;1800;;False
2022-07-08;outfit.12852c024f984b2998c4f3969d664d88;Dotted Rust Top;Diane Von Fürstenberg;Høyer;2 - Very good condition;;5200;1499.0;False
2023-12-12;outfit.12c32249479548ebabd4d776138873fd;L Bente Jet Stream White ;FWSS;FWSS;2 - Very good condition;;2600;800.0;False
2023-01-10;outfit.12cf865f9ba1407e9a08ec1df40a58d6;L Double Cuff White Button-Up;Aris;For Ynde;2 - Very good condition;;2300;450.0;False
;outfit.1378c78099224f24a8b3cf7007cdb4d5;XS Zip Up Lace Top White;MAUD;FJONG;5 - Damaged;stor flekk på rygg. ;;;False
;outfit.13b4586fba46462abebff1b7b145e499;L Alinka Martini Oliva Dress;Untold Stories;FJONG;2 - Very good condition;;2600;550.0;False
2023-05-15;outfit.13df7ddb6fb6435ba54b025aa6a57804;Blossom Embroidery Summer Coat;SoyaAulait;Soyaaulait;2 - Very good condition;pensjonert pga salgsdag;3400;1100.0;False
2024-01-25;outfit.13e5c7e0037f485db252abd2d7ec9e79;Isadora Top Yellow Adele Floral Print;Faithfull The Brand;Den Dama;3 - Good condition;;2200;599.0;False
2022-08-30;outfit.142bb41b42464fbf8e7b54e21d9ac3c4;Turf Green Dharma Skirt;By Malene Birger;FJONG;5 - Damaged;;2900;700.0;True
2022-08-16;outfit.1431039944fe4be88f8890a04a346b09;S Kitty Ponderosa Pine Dress;FWSS;FJONG;2 - Very good condition;;5200;1499.0;False
2023-10-31;outfit.14727804dc6945f9baabcd76ad96a744;Turf Green Donella Blazer;By Malene Birger;FJONG;4 - Minor defects;Hemper bak i nakke er godt brukt, halsutrigningen har utvidet seg noe;2000;600.0;True
2022-08-30;outfit.1507c18a72e34435a790eae1b878aa86;Sky Captain Wave Knit Top;MAUD;Høyer;4 - Minor defects;Flekk på hvit stripe;5300;1590.0000000000005;False
2023-01-12;outfit.150ea04dfe684f8aacffdaf604ed3120;XS Blue Prestina Pants;C.L.E.A.N. by Christina Ledang;C.L.E.A.N. by Christina Ledang;4 - Minor defects;Flekker som ikke går bort. ;6000;1200.0;False
2024-01-25;outfit.15446bc8b1b143bb8c7f8366923d578d;1 White Jacquard Top;By Malene Birger;Høyer;4 - Minor defects;Flekk som ikke går bort;4500;1350.0;False
2023-05-15;outfit.154636a0114a4afeaefa0d2345ce2bed;XS Ceiling Block Print Aria Dress;Holzweiler;Holzweiler;4 - Minor defects;Slitt i ermet bak. syntes ikke så godt.;4200;1260.0;False
2024-01-25;outfit.15a09ec0aa3f41db855b6d598ed259e1;Orca Chiffon Top;By Malene Birger;Høyer;4 - Minor defects;Wear and Tear;4000;1299.0;True
2023-12-12;outfit.1642071c303e44a19ce63dfbbf8384bd;S The Rosalie Blazer;Bastet Noir;Bastet Noir;4 - Minor defects;Reparert nederst i glidelås, normal slitasje i stoff;1500;450.0;True
2023-09-19;outfit.165b95aa6e764d5280b1fa80bb7755c8;Blue Leona Tank Top;SOYAAULAIT;Soyaaulait;4 - Minor defects;Flekkete langs nedre kant, nupper i stoffet;1500;450.0;True
2022-06-10;outfit.165c8b5ec09b44d28fc8a4368e2b8082;L Light beige - Marais Blazer;ENVELOPE1976;Envelope 1976;4 - Minor defects;Flekkete langs nedre kant, nupper i stoffet;1500;450.0;True
2023-09-19;outfit.16a9ddab11bd4518897061d811316940;Faye Shoulder Dress Blue;MagMaLou;MagMaLou;4 - Minor defects;Litt flekker langs nedre kant;1500;450.0;True
2023-10-31;outfit.16d88d0fdcb7455fb6a81ec2639afea9;Heaston Skirt Dusty Cedar;Samsøe & Samsøe;FJONG;4 - Minor defects;Flekk;1300;600.0;True
;outfit.16e87e3968054dc8824ba7ff56aed7f4;M Red Flowers Summer Rouching Gown;byTiMo;FJONG;4 - Minor defects;Flekker foran, litt slitaje i stoff;750;250.0;True
2023-09-19;outfit.170d553601c744e393427a92c0cf58b3;Mira Zhoe Floral Wrap Dress;Faithfull The Brand;FJONG;4 - Minor defects;Stain on right arm;3600;1080.0;False
2023-01-10;outfit.171c86f3627845c08df08a82deb2241f;Satin Wrap Dress Jacquard Golden;byTiMo;Fjong;3 - Good condition;synlig reaparert hull på høyre side ved mageområdet;2000;600.0;False
2023-10-31;outfit.173befabe7a14130b0e646ca4152150c;Silk Top;Céline;Gunhild Stordalen;4 - Minor defects;Retarert i sidesøm, ellers god stand;3800;749.0;False
2023-01-10;outfit.1741f5f96ff24df6a415cdb7db237c45;Smoke Bjørg Shaggy Dress;SOYAAULAIT;Soyaaulait;4 - Minor defects;leather on neckline worn out;3150;945.0;False
2024-01-25;outfit.17558a1ae0a7421b9ebd4bc717e24b09;Ifaya Pink Blouse;By Malene Birger;FJONG;4 - Minor defects;Mangler belte, ellers som ny;1000;349.0;True
2023-05-15;outfit.178816264aec41579db79e1bcf1b01a7;XS Spring Dress Grey;C.L.E.A.N. by Christina Ledang;C.L.E.A.N. by Christina Ledang;4 - Minor defects;Har noen små flekker bak på skjørtet, men vises ikke så godt. Ser fresht ut ellers;1350;400.0;True
2023-05-15;outfit.17d697a3168347bcb51b5bddf26426a2;XS Black Affair Dress;Holzweiler;Holzweiler;4 - Minor defects;Worn out, begining hole in back;3400;400.0;True
2023-09-15;outfit.181629c720b548f4a77a22851f1fbbce;S2 Gardenia Elysian Shirt;Karen by Simonsen;For Ynde;4 - Minor defects;slitt i sømmen i skrittet. lite hull ved lommen bak ikke veldig dynlig;2100;600.0;True
2023-09-15;outfit.18da12c5ecd149ccb6618cb53fb8262c;Sand Sagene Jacket;Holzweiler;HOLZWEILER;4 - Minor defects;flekker foran som ikke går bort i rens;1300;400.0;True
2023-12-12;outfit.19ec1848ceb8402b956e33003d252ccd;The Long Sleeved Kaftan Dress, Black;AWAN;AWAN;4 - Minor defects;misfarging i stoffet bak (ser ut som det er en del av printet);1900;550.0;True
2022-06-10;outfit.19f4932d209d4886bfe838d5677f09ed;XS Hawaiian Sunset Wrap Dress;MAUD;FJONG;4 - Minor defects;misfarging i stoffet på rygg - veldig lite;1000;300.0;True
2024-01-25;outfit.1a0d16e8be3649498b202bba8ea1743b;Auburn Layered Ruffle Blouse;Maud;FJONG;4 - Minor defects;antydning til flekk foran;3500;1050.0;True
2023-12-12;outfit.1a265d0988ad4e86966114062e4ca547;S Flared Dress Bloom;byTiMo;FJONG;4 - Minor defects;Mangler en knapp foran (spesialknapper);3500;1500.0;True
2024-01-25;outfit.1a5d811e31da4b90b7bb7231ebbdd696;2 Cameron Creme Blouse;Ganni;Høyer;4 - Minor defects;slitt på ermene;3200;700.0;True
;outfit.1abb743732ab455789b71cf43061f073;S Red Risandra Dress;By Malene Birger;Høyer;4 - Minor defects;slitt på ermene;3200;950.0;True
2023-12-12;outfit.1ad07ee4daee4450a865411d843b8130;XXL Denim Dress;Ane Mone;Ane Mone;4 - Minor defects;brent hull i kappe nederst;3500;1050.0;True
2023-09-15;outfit.1ad445e5454c42c795e33d82bbecd98f;White Marlene Jumpsuit;Urban Pioneers;Urban Pioneers;4 - Minor defects;fake-skinnet i halsen er helt flasset;3000;900.0;False
;outfit.1aeaa943d2aa4fea9c30dfadc8e77b38;M2 Franco Shirt Blue Surf;IBEN;IBEN (Storheil Agency);4 - Minor defects;Gule flekker som ikke går bort;3000;749.0;True
2024-01-25;outfit.1af94bab198546d9959ab6c656455ddb;Maria Blouse;Urban Pioneers;Urban Pioneers;4 - Minor defects;Wear and tear - hull som er sydd igjen ved zipper;3200;749.0;True
2022-07-13;outfit.1b10aae2897d40d9ac491e7a93440192;Yellow Oda Jeans;Holzweiler;Holzweiler;4 - Minor defects;Flekker foran på skjørtet;2900;200.0;True
2023-12-12;outfit.1b308c0bf532439dbb6be76ea959786a;XS Purify Top;2NDDAY;Mani Studio Moss;4 - Minor defects;Godt brukt;2000;400.0;True
2023-09-19;outfit.1b3a8279b2b64c4c8bcbb8baf6d6348e;Dots Hot Pink Native New Yorker Pants;Høst & Vår;Høst & Vår;4 - Minor defects;Godt brukt;1900;550.0;True
2023-01-10;outfit.1b9ab78223b843e08e1daeb660783adf;S Emi Stripe Blouse;Untold Stories;FJONG;4 - Minor defects;veldig fadet i stoffet, pluss veldig mørk på ryggen ved nakken.;4000;799.0;True
2023-12-12;outfit.1ba117ad1dfc4db98e92536c9d6724fe;XS Vintage Cotton High Neck Vintage White Top;byTiMo;FJONG;4 - Minor defects;Wear and tear;3600;899.0;True
;outfit.1bee365da3a84e53aecc44958f9c7bf8;XS 2 Blue Floral Shirt;By Malene Birger;Høyer;4 - Minor defects;Slitt;4000;1200.0;True
2023-12-12;outfit.1c009820b8df49c8b96add8559ebacea;XS Bon Sweater Rose Gem ;Rodebjer;Rodebjer;4 - Minor defects;;1400;550.0;True
2023-05-15;outfit.1d019cb2152540609969684aa547d21e;XS Aliquan Green Sengi Top;Holzweiler;Holzweiler;4 - Minor defects;;1400;550.0;True
2024-01-25;outfit.1d4e8c2917e1443cbbceae081f952e15;White Sunniva Linen Shirt;Urban Pioneers;Urban Pioneers;4 - Minor defects;;1600;600.0;True
2022-10-24;outfit.1d591536f5d34b00b5fefcf4d190cfd9;XL Vetiver Costa Long Dress;Maud;FJONG;4 - Minor defects;Repaired + wear and tear;3000;749.0;False
2024-01-25;outfit.1d8ae52243c24ceb98799172194e0328;Hellin Top;By Malene Birger;Høyer;4 - Minor defects;Flekk på brystet under blondene;1600;400.0;True
2023-09-15;outfit.1e2f1364650a490d9805a1dbe1519e8c;Vintage Burberry Trench Coat;Burberry;FJONG;4 - Minor defects;item has been repaired and the size in front (chest) is a bit tighter, item is also worn out;2600;650.0;False
2023-05-15;outfit.1e93d020236b4784a8c6f7bfd5eb69a4;L Blue Leona Tank Top;SOYAAULAIT;Soyaaulait;4 - Minor defects;Små flekker på omslag;1700;400.0;True
;outfit.1ea9f8408fd649a48f2c4f1fde128d4d;L Draped Flower Skirt Aspen Gold;MAUD;Høyer;4 - Minor defects;Unremovable stains;2800;600.0;True
2023-09-19;outfit.1f534d95ccf6415a8af3b5799dd959e7;Belianna Coat;By Malene Birger;FJONG;4 - Minor defects;Har ett vannmerke på høyre side i front som ikke går bort. Nesten usynlig når du ser på den, men synlig når den er på.;1900;550.0;True
2023-05-15;outfit.200c88e2c54d4176a8c67623f8a24bc3;XS Green Voss Skirt;Holzweiler;Holzweiler;4 - Minor defects;Flekk;3800;1100.0;True
2024-01-25;outfit.20302c7bdf464ee38ee927f28984fc14;Sotra Skirt Green Stripes;Holzweiler;Holzweiler;4 - Minor defects;Beltet holder på å ryke;1500;450.0;True
2023-09-15;outfit.206a16e3dd4e4e0babd00f04357e55e6;Mesima Shirt Dress;Camilla Pihl;Villoid;4 - Minor defects;Små flekker bak;3500;1050.0;True
;outfit.207c866957714c84b7ef61de627a8c3d;L Lima Sky Blue Dress;MAUD;FJONG;4 - Minor defects;Lukter litt svette under den ene armen.;3900;1200.0;True
2024-01-25;outfit.218745803f1b42e992eb576744b2a172;Yasmin Beige Skirt ;FWSS;FWSS;4 - Minor defects;Slitt;2200;550.0;True
2023-09-19;outfit.21a5209b91c342a4a0e587fb91f592f5;Black Stone Dress;Maja Stabel;Maja Stabel;4 - Minor defects;Slitt under armene. ;4700;1200.0;True
2022-06-10;outfit.21c28bc4e7744c59a30ed4676ea1d444;M Rebel Red Classic Crewneck;Cardsome;Cardsome;4 - Minor defects;;7200;2500.0;True
2023-05-15;outfit.21def3c682b9458da15fbbd6a0135dcf;S Spring Dress Grey;C.L.E.A.N. by Christina Ledang;C.L.E.A.N. by Christina Ledang;4 - Minor defects;;7200;1900.0;True
2022-06-10;outfit.227174c0c0b84b3288fe664f86f0bf9e;L Pink Sweatshirt;Studio Bazar;Studio Bazar;4 - Minor defects;Slitt, Hull i lommer;3700;1110.0;False
;outfit.2297c26b5b6a4081891a5d4aaca0db7e;S White Backless Lace Maxi Dress;Lulus;FJONG;4 - Minor defects;Falmet i stoffet;2900;700.0;True
2023-10-31;outfit.22ff5d532d24420891c0292df8da84dd;Theta Silver Dress;Samsøe & Samsøe;FJONG;4 - Minor defects;Some discoloring;2800;599.0;True
2023-05-15;outfit.232c502605b34b0c986aadc1fb812fc5;XS Ecru Lenient Jumpsuit;Holzweiler;Holzweiler;4 - Minor defects;Noen flekker etter rens;6000;1440.0;True
2023-06-15;outfit.233cc1a575934df38cc3c307901345e5;L Serena Dark Sapphire;Samsøe Samsøe;FJONG;4 - Minor defects;Flekk bak som ikke går vekk;2000;600.0;True
2023-12-12;outfit.234ce093695f4773aba7287620cee9ca;M Ferdinand Dress;IBEN;IBEN (Storheil Agency);4 - Minor defects;;2200;700.0;True
;outfit.23bf2c58e916407987746990096b204e;S Tondio Silk Satin Fire Dress;By Malene Birger;FJONG;4 - Minor defects;stoffet begynner å bli slitt og slitasje over ermene bør pensjoneres;3600;1000.0;True
2023-12-12;outfit.241022fcc99d497da06c08e99ce6f3e9;M Fiona Blazer Black Silver  crop;ROTATE;Oxholm;4 - Minor defects;Pennemerke ;1300;500.0;True
2024-01-25;outfit.2463e342a360415b8148b44368519252;Voile Bohemian Shirt;Forte Forte;Den Dama;4 - Minor defects;Krympet i rens - men fortsatt en str.S;1900;600.0;True
2023-08-30;outfit.2520676759bd47758b29a8512bb8b409;S Pink Alpaca Sweater;Urban Pioneers;Urban Pioneers;4 - Minor defects;Litt bruksmerker på blandt annet ermer.;1900;600.0;True
2023-09-15;outfit.254e2fd341124a79bf0f20196ebd37e7;3 Emberglow Flower Volume Shirt;Maud;Høyer;4 - Minor defects;Is streched over the arms, should go out of stock;2000;499.0;True
2024-01-25;outfit.266dce4381f04b03aaf3edf148cd2a3e;2 Painter Cecilie Shirt;Britt Sisseck;Høyer;4 - Minor defects;Has fabric discoloration on the lower left side of the skirt.;1200;350.0;True
2022-09-15;outfit.269a9d54e3b549339e04ce417061a152;Coal Issey Pant;Kupong knit.wear;Kupong knit.wear;4 - Minor defects;Wear and tear;1700;500.0;True
2024-01-25;outfit.269c4cf0423f4fe3b0305c24447fe1c8;Floral Ring My Bell Top;Høst & Vår;Høst & Vår;4 - Minor defects;wear and tear in fabric;4200;900.0;True
2023-10-31;outfit.26a6d5aa3fea4de08cb8723770250042;Sky Blue Fitted Pants;Gucci;Gunhild Stordalen;4 - Minor defects;Flekk som ikke går bort;1300;400.0;True
2024-01-25;outfit.26b00593f2f640beb2046d4cbbc5d047;Floral Ring My Bell Top;Høst & Vår;Høst & Vår;4 - Minor defects;Slitt langs nedre kant;5800;1700.0;True
;outfit.270d254f002a48f482baa0bb0c700d31;S Gloriosah Cream Blouse;By Malene Birger;Høyer;4 - Minor defects;Wear and tear, faded color;1500;450.0;True
2024-01-25;outfit.271d5f29910a40a98a7b49226d4b18d8;Terin ls Silver Top;Samsøe & Samsøe;FJONG;4 - Minor defects;Veldig slitt i stoffet, + ett hull under belte, sender på repair før den går til 3C;1800;500.0;False
2023-01-12;outfit.271e1d0e1253427b83abf7dead943c60;Simone Vanilla Custard Dress;FWSS;FWSS;4 - Minor defects;Flekk;700;250.0;False
2023-09-19;outfit.2739bdf215b24c19aa425915f94a9dee;Brigitte Shoulder Dress;MagMaLou;MagMaLou;4 - Minor defects;Flekk foran (små);1500;450.0;True
2023-05-15;outfit.27966c6c18124f63a9dcc55015ee70e4;Red Knitted Beanie;C.L.E.A.N. by Christina Ledang;C.L.E.A.N. by Christina Ledang;3 - Good condition;;2500;890.0;False
2024-01-25;outfit.2808d04f92e6449d93dd07dc098e4f4e;L1 Stratosphere Cold-Shoulder Top;Ghospell;For Ynde;4 - Minor defects;Hull langs nedre kant;2500;699.0;True
;outfit.2810ae4baded4b949ae5197afa54e91a;XS Stranda Skirt Yellow Stripe;Holzweiler;FJONG;4 - Minor defects;Wear and tear;2200;650.0;True
2023-09-15;outfit.28256fea7e9a477ebc136d3aa40861d9;White Judi Shirt;Ella&il;ella&il;4 - Minor defects;Stains in front (Small);1500;450.0;True
2023-05-15;outfit.289d776ab4654bca91f229223843cea1;S Feather Embroidery Contrast Dress;SoyaAulait;Soyaaulait;4 - Minor defects;Wear and tear;2500;600.0;True
2023-05-15;outfit.28a83fc7d67245ed8eadaa5dd4a5d354;S Dark Coral Sweater;Urban Pioneers;Urban Pioneers;4 - Minor defects;Discoloration in fabric (small stains, barely visible);5400;1500.0;True
2023-05-15;outfit.293a9e98118b430a8581ed862228b106;S Blossom Embroidery Raglan Sleeve Dress;SoyaAulait;Soyaaulait;4 - Minor defects;noe små flekker. ;2500;750.0;False
2023-09-19;outfit.2942d8a51f8f4f44aa8ab50dd0be2e22;Double Sandy Set;Maja Stabel;Maja Stabel;4 - Minor defects;Nupper;2100;500.0;True
2023-01-12;outfit.29a15040d786470dbaf8e45ac2dfaa12;2 Elenor Wrap Blouse;Creative Collective;Høyer;4 - Minor defects;Slitt;2500;750.0;False
